{
  "artifacts": [
    {
      "bytes": 4954,
      "depends_on": [
        "canonical_evidence"
      ],
      "format": "json",
      "generated_at": "2026-07-15T09:07:00+00:00",
      "input_hash": "sha256:v21-identity-fixture",
      "join_keys": [
        "candidate_id",
        "material_id",
        "use_instance_id",
        "source_identity_id"
      ],
      "kind": "candidate_identity_registry",
      "path": "candidate-identity-registry.json",
      "producer_version": "spirosearch-v21",
      "record_count": null,
      "run_id": "v21-identity-fixture",
      "schema_ref": "schemas/candidate-identity-registry.schema.json",
      "schema_version": "v6.run_artifact.v1",
      "sha256": "6d30eb76e34c0385d308d599dc619ac6d15f472b074efc465a0556c5ffaf0867"
    },
    {
      "bytes": 2553,
      "depends_on": [
        "candidate_identity_registry",
        "canonical_evidence",
        "literature_claims"
      ],
      "format": "jsonl",
      "generated_at": "2026-07-15T09:07:00+00:00",
      "input_hash": "sha256:v21-identity-fixture",
      "join_keys": [
        "link_id",
        "candidate_id",
        "evidence_id",
        "doi",
        "review_item_id"
      ],
      "kind": "candidate_evidence_links",
      "path": "candidate-evidence-links.jsonl",
      "producer_version": "spirosearch-v21",
      "record_count": 3,
      "run_id": "v21-identity-fixture",
      "schema_ref": "schemas/candidate-evidence-link.schema.json",
      "schema_version": "v6.run_artifact.v1",
      "sha256": "53b784a5924853536e5cd15ee7d5a2739d37d0652f336ada7eb6ee039217113e"
    }
  ],
  "generated_at": "2026-07-15T09:07:00+00:00",
  "input_hash": "sha256:v21-identity-fixture",
  "producer_version": "spirosearch-v21",
  "run_id": "v21-identity-fixture",
  "schema_version": "v6.run_manifest.v1"
}
